{
  "schema_version": "1.0.0",
  "part_id": "993-ENG-CHAIN-CASE-0001",
  "name": "993 timing chain case and its lids",
  "description": "Investigation target: the chain case from factory plate 103-05, its three lids, its oil bridges and its tensioner. The record establishes identity and material reasoning; it is neither a replacement geometry nor a manufacturing authorization. Selected because the factory catalogue triage makes it a serious consolidation case — and because the titanium grid rejects it three times.",
  "vehicle": {
    "generation": "993",
    "variants": [
      "993_all_models_to_confirm_by_variant"
    ],
    "model_years": {
      "from": 1994,
      "to": 1998
    },
    "porsche_part_numbers": [
      "993 105 093 05",
      "964 105 094 04",
      "993 105 022 01",
      "964 105 107 01",
      "964 105 108 01",
      "993 107 087 51",
      "993 107 088 52",
      "993 107 088 00"
    ]
  },
  "classification": {
    "category": "engine_timing_chain_case",
    "safety_class": "prohibited_pending_engineering",
    "intended_use": "Documentary investigation and process comparison; no manufacturing, no fitting, no start-up"
  },
  "geometry": {
    "source_type": "estimated",
    "master_format": "build123d",
    "master_file": "scripts/build_993_concept_f0.py",
    "units": "mm",
    "accuracy_mm": null,
    "derived_files": [
      "parts/993-eng-chain-case-0001/derived/chain_case_concept_f0.step"
    ]
  },
  "provenance": {
    "record_license": "All rights reserved (see LICENSE) for the record; no third-party geometry redistributed",
    "sources": [
      {
        "title": "993 factory catalogue, plate 103-05 Chain case",
        "url": "https://porschefanatics.com/oem/993/103-05/",
        "source_type": "official",
        "license": "catalogue-usine-reference-seulement",
        "accessed_on": "2026-09-11",
        "notes": "Identifies two `chain case`, three `lid`, two `chain adjuster`, one `bearing`, one `heat protection plate` and three `bridge`, two of which are also described as `oil gallery`. Establishes no dimension, no material and no interface. See SRC-PET-993-103-05-CHAIN-CASE."
      }
    ]
  },
  "manufacturing": {
    "candidate_processes": [
      "casting",
      "LPBF",
      "CNC"
    ],
    "preferred_process": "undecided",
    "material": {
      "family": "aluminum, for consistency with the engine case",
      "grade": "unidentified; the original is a casting whose grade is not published",
      "standard": ""
    },
    "post_processing": [],
    "supplier_requirements": []
  },
  "titanium": {
    "applicable": false,
    "alloy": "",
    "heat_treatment": "",
    "hip_required": "not_applicable",
    "machined_surfaces": [],
    "inspection": [],
    "galvanic_isolation": "Not applicable: titanium is ruled out. That is precisely one of the reasons — a titanium case bolted to an aluminum engine case creates a galvanic couple that the TITANIUM.md grid rejects."
  },
  "validation": {
    "status": "concept",
    "vehicle_tested": [],
    "evidence": [
      "catalog/sources/src-pet-993-103-05-chain-case.json",
      "docs/993/993_CACHE_DE_CHAINE_103-05.md"
    ],
    "reviewed_by": "",
    "reviewed_on": null,
    "known_limits": [
      "No dimension, no material and no interface is established: the catalogue identifies, it does not dimension.",
      "The grade of the original case is not published; \"aluminum\" is an inference from consistency with the engine case, not an identification.",
      "The case carries the timing drive and pressurized oil: its failure can cost the engine, and the oil has hot neighbors on this plate, which includes a heat protection plate.",
      "Titanium is ruled out by three independent contraindications from the grid: differential expansion against the aluminum case, threads reworked at every removal, galvanic couple with aluminum.",
      "The real additive gain — consolidating the case, the bridges and the oil galleries — is not investigated and will not be without measuring a physical example."
    ]
  }
}
