{
  "schema_version": "1.0.0",
  "part_id": "993-INT-SEAT-RAIL-COVER-0001",
  "name": "Seat rail cover, outer side",
  "description": "Trim cover for the seat rail, existing in symmetrical left and right versions. Selected as the pilot for the symmetrical category of phase 2: a missing piece must be reconstructed from its counterpart and its surroundings.",
  "vehicle": {
    "generation": "993",
    "variants": [
      "to_confirm_on_vehicle"
    ],
    "model_years": {
      "from": 1994,
      "to": 1998
    },
    "porsche_part_numbers": []
  },
  "classification": {
    "category": "interior_trim",
    "safety_class": "non_critical",
    "intended_use": "Trim for the seat rail, with no role in retaining the seat or the occupant"
  },
  "geometry": {
    "source_type": "estimated",
    "master_format": "build123d",
    "master_file": "scripts/build_993_concept_f0.py",
    "units": "mm",
    "accuracy_mm": null,
    "derived_files": [
      "parts/993-int-seat-rail-cover-0001/derived/seat_rail_cover_concept_f0.step"
    ]
  },
  "provenance": {
    "record_license": "All rights reserved (see LICENSE) for the record, geometry not yet produced",
    "sources": [
      {
        "title": "9xxteile - Porsche parts diagrams (PET exploded views)",
        "url": "https://www.9xxteile.com/en/pet/",
        "source_type": "community",
        "license": "third-party-site-copyright-reference-only",
        "accessed_on": "2026-08-28",
        "notes": "Confirms the existence of distinct left and right part numbers. No dimension."
      }
    ]
  },
  "manufacturing": {
    "candidate_processes": [
      "FFF",
      "SLS",
      "MJF"
    ],
    "preferred_process": "FFF",
    "material": {
      "family": "polymer",
      "grade": "to_be_determined_after_fit_test",
      "standard": "none"
    },
    "post_processing": [
      "deburring",
      "check of the clearance with the seat rail"
    ],
    "supplier_requirements": []
  },
  "titanium": {
    "applicable": false,
    "alloy": "",
    "heat_treatment": "",
    "hip_required": "not_applicable",
    "machined_surfaces": [],
    "inspection": [],
    "galvanic_isolation": "not applicable, polymer interior trim part"
  },
  "validation": {
    "status": "concept",
    "vehicle_tested": [],
    "evidence": [],
    "reviewed_by": "",
    "reviewed_on": null,
    "known_limits": [
      "Left-right symmetry is assumed and must be verified by measurement before any mirroring.",
      "The seat and the rail differ by equipment: variant to be confirmed.",
      "No measurement taken.",
      "A part obtained by mirroring does not replace verification of the real interfaces.",
      "Porsche part numbers unsourced: 9xxteile shows distinct left and right numbers, but no repository source transcribes them with a PET plate and position.",
      "Evidence owner (decision 0013): documentary evidence, the maintainer (desk review of existing sources); physical capture, unassigned, awaits an external contributor."
    ]
  }
}
